### ISSUE TITLE
DCE5 cluster with multus, macvlan and Calico network, the macvlan pod (standalone mode) cannot access the HTTP interface of the Calico pod via curl.

### ISSUE THREAD

**Issue by leolingg** [spidernet-io/cni-plugins#177]
**What happend**:
DCE5 cluster with multus, macvlan and Calico network, the macvlan pod (standalone mode) cannot access the HTTP interface of the Calico pod via curl.

**What you expected to happen**:
It can be accessed normally via the curl command.

**How to reproduce it (as minimally and precisely as possible)**:
Deploy the macvlan pod (standalone mode) and calico pod on different nodes respectively, and expose an arbitrary HTTP service. Use the curl command in the macvlan pod to access the calico pod.

**Anything else we need to know?**:
We have identified the cause of this issue, which is mainly due to the following iptables rules.
![图片](https://github.com/spidernet-io/cni-plugins/assets/26449069/9c6d3080-785e-47d5-8068-14d8459a0612)
 If we remove this rule, the problem can be resolved. However, this rule is refreshed by kube-proxy when any pod is added or deleted arbitrarily.
The principle is that there is a routing asymmetry problem with the packets going out and coming back when macvlan is used in standalone mode. The iptables rule of kube-proxy will discard the packets with routing asymmetry.

**Environment**:

  image path and image ID (from 'docker images')
```
192.168.124.65/spidernet-io/cni-plugins/meta-plugins             v0.2.1              7533e21fd266    2 weeks ago     linux/amd64    0.0 B      37.1 MiB
```
- Kubernetes version (use `kubectl version`):
```
WARNING: This version information is deprecated and will be replaced with the output from kubectl version --short.  Use --output=yaml|json to get the full version.
Client Version: version.Info{Major:"1", Minor:"25", GitVersion:"v1.25.4", GitCommit:"872a965c6c6526caa949f0c6ac028ef7aff3fb78", GitTreeState:"clean", BuildDate:"2022-11-09T13:36:36Z", GoVersion:"go1.19.3", Compiler:"gc", Platform:"linux/amd64"}
Kustomize Version: v4.5.7
Server Version: version.Info{Major:"1", Minor:"25", GitVersion:"v1.25.4", GitCommit:"872a965c6c6526caa949f0c6ac028ef7aff3fb78", GitTreeState:"clean", BuildDate:"2022-11-09T13:29:58Z", GoVersion:"go1.19.3", Compiler:"gc", Platform:"linux/amd64"}
```
- Primary CNI for Kubernetes cluster: `calico`
- NetworkAttachment info (use `kubectl get net-attach-def -o yaml`)
```yaml
apiVersion: k8s.cni.cncf.io/v1
kind: NetworkAttachmentDefinition
metadata:
  annotations:
    v1.multus-underlay-cni.io/coexist-types: '["macvlan_standalone"]'
    v1.multus-underlay-cni.io/default-cni: "true"
    v1.multus-underlay-cni.io/instance-status: enable
    v1.multus-underlay-cni.io/instance-type: macvlan_standalone
    v1.multus-underlay-cni.io/underlay-cni: "true"
    v1.multus-underlay-cni.io/vlanId: "168"
  labels:
    v1.multus-underlay-cni.io/instance-status: enable
  name: macvlan-standalone-vlan168
  namespace: kube-system
spec:
  config: |-
    {
        "cniVersion": "0.3.1",
        "name": "macvlan-standalone-168",
        "plugins": [
            {
                "type": "macvlan",
                "master": "vlan168",
                "vlanId": "168",
                "mode": "bridge",
                "ipam": {
                    "type": "spiderpool",
                    "log_level": "DEBUG",
                    "log_file_path": "/var/log/spidernet/spiderpool.log",
                    "log_file_max_size": 100,
                    "log_file_max_age": 30,
                    "log_file_max_count": 10
                }
            },{
                "type": "veth",
                "service_hijack_subnet": ["10.13.0.0/16"],
                "overlay_hijack_subnet": ["10.12.0.0/16"],
                "additional_hijack_subnet": [],
                "migrate_route": -1,
                "rp_filter": {
                    "set_host": true,
                    "value": 0
                },
                "skip_call": false
            }
        ]
    }
```
- Target pod yaml info (with annotation, use `kubectl get pod <podname> -o yaml`)
```yaml
apiVersion: v1
kind: Pod
metadata:
  annotations:
    ipam.spidernet.io/ippools: '[{"interface":"eth0","ipv4":["vlan168-public"]}]'
    k8s.v1.cni.cncf.io/network-status: |-
      [{
          "name": "kube-system/macvlan-standalone-vlan168",
          "interface": "eth0",
          "ips": [
              "192.169.91.241"
          ],
          "mac": "8e:a2:8b:0d:e0:d3",
          "default": true,
          "dns": {}
      }]
    k8s.v1.cni.cncf.io/networks-status: |-
      [{
          "name": "kube-system/macvlan-standalone-vlan168",
          "interface": "eth0",
          "ips": [
              "192.169.91.241"
          ],
          "mac": "8e:a2:8b:0d:e0:d3",
          "default": true,
          "dns": {}
      }]
    v1.multus-cni.io/default-network: kube-system/macvlan-standalone-vlan168
  creationTimestamp: "2023-05-09T07:12:33Z"
  generateName: wf-test-5c84c65968-
  labels:
    app: wf-test
    pod-template-hash: 5c84c65968
  name: wf-test-5c84c65968-c8f97
  namespace: default
  ownerReferences:
  - apiVersion: apps/v1
    blockOwnerDeletion: true
    controller: true
    kind: ReplicaSet
    name: wf-test-5c84c65968
    uid: ad821bed-4e57-40e5-a267-9bbf82cf55d9
  resourceVersion: "6121940"
  uid: e4ca713b-0aa6-470b-a43b-b93753760f6d
spec:
  containers:
  - image: 192.168.124.65/daocloud/dao-2048:v1.3.1
    imagePullPolicy: IfNotPresent
    lifecycle: {}
    name: container-1
    resources:
      limits:
        cpu: 250m
        memory: 512Mi
      requests:
        cpu: 250m
        memory: 512Mi
    securityContext:
      privileged: false
    terminationMessagePath: /dev/termination-log
    terminationMessagePolicy: File
    volumeMounts:
    - mountPath: /var/run/secrets/kubernetes.io/serviceaccount
      name: kube-api-access-rp7lf
      readOnly: true
  dnsConfig: {}
  dnsPolicy: ClusterFirst
  enableServiceLinks: true
  nodeName: node-2
  preemptionPolicy: PreemptLowerPriority
  priority: 0
  restartPolicy: Always
  schedulerName: default-scheduler
  securityContext: {}
  serviceAccount: default
  serviceAccountName: default
  terminationGracePeriodSeconds: 30
  tolerations:
  - effect: NoExecute
    key: node.kubernetes.io/not-ready
    operator: Exists
    tolerationSeconds: 300
  - effect: NoExecute
    key: node.kubernetes.io/unreachable
    operator: Exists
    tolerationSeconds: 300
  volumes:
  - name: kube-api-access-rp7lf
    projected:
      defaultMode: 420
      sources:
      - serviceAccountToken:
          expirationSeconds: 3607
          path: token
      - configMap:
          items:
          - key: ca.crt
            path: ca.crt
          name: kube-root-ca.crt
      - downwardAPI:
          items:
          - fieldRef:
              apiVersion: v1
              fieldPath: metadata.namespace
            path: namespace
status:
  conditions:
  - lastProbeTime: null
    lastTransitionTime: "2023-05-09T07:12:33Z"
    status: "True"
    type: Initialized
  - lastProbeTime: null
    lastTransitionTime: "2023-05-09T07:12:34Z"
    status: "True"
    type: Ready
  - lastProbeTime: null
    lastTransitionTime: "2023-05-09T07:12:34Z"
    status: "True"
    type: ContainersReady
  - lastProbeTime: null
    lastTransitionTime: "2023-05-09T07:12:33Z"
    status: "True"
    type: PodScheduled
  containerStatuses:
  - containerID: containerd://547235ff49a1ca21411f5ace5ec3d0c38bfd52aa27d47ce5cd0fb9b5e11d8afb
    image: 192.168.124.65/daocloud/dao-2048:v1.3.1
    imageID: 192.168.124.65/daocloud/dao-2048@sha256:895c56dabc0f75153050b0b596e679714c473dcf94682105f5468cfb334cb787
    lastState: {}
    name: container-1
    ready: true
    restartCount: 0
    started: true
    state:
      running:
        startedAt: "2023-05-09T07:12:33Z"
  hostIP: 192.168.80.82
  phase: Running
  podIP: 192.169.91.241
  podIPs:
  - ip: 192.169.91.241
  qosClass: Guaranteed
  startTime: "2023-05-09T07:12:33Z"
```

**Comment by cyclinder** [comment]
Thanks for the report @leolingg

Can you show more info by following the commands?

- kubectl get po -o wide
- ip a show vlan168
- ip r 
- calicoctl get ippools -o wide
- kubectl exec -it <macvlan_pod> -- ip a 
-  kubectl exec -it <macvlan_pod> -- ip r

**Comment by leolingg** [comment]
@cyclinder 
- kubectl get po -o wide
```
NAME                            READY   STATUS    RESTARTS   AGE     IP              NODE                NOMINATED NODE   READINESS GATES
linao-calico-668c997d86-d5bbv   1/1     Running   0          4h47m   10.12.247.26    node-2              <none>           <none>
linao-calico-668c997d86-rgb9k   1/1     Running   0          29h     10.12.10.67     controller-node-1   <none>           <none>
wf-calico-7cd95c7c5b-nzhsf      1/1     Running   0          5d22h   10.12.247.2     node-2              <none>           <none>
wf-test-5c84c65968-c8f97        1/1     Running   0          23h     192.169.91.241   node-2              <none>           <none>
wf-test-5c84c65968-mnp8n        1/1     Running   0          23h     192.169.91.240   controller-node-1   <none>           <none>
```
- ip a show vlan168
```
11: vlan168@eno2: <BROADCAST,MULTICAST,UP,LOWER_UP> mtu 1500 qdisc noqueue state UP group default qlen 1000
    link/ether 30:b9:30:07:a9:48 brd ff:ff:ff:ff:ff:ff
```
- ip r
```
# controller-node-1
[root@controller-node-1 ~]# ip r
# node-2
[root@node-2 ~]# ip r
default via 192.168.80.1 dev eno1 proto static metric 100 
10.12.10.64/26 via 192.168.80.81 dev eno1 proto bird 
blackhole 10.12.247.0/26 proto bird 
10.12.247.1 dev cali07be2c892a3 scope link 
10.12.247.2 dev cali39a27f87109 scope link 
10.12.247.14 dev calie3e89046d02 scope link 
10.12.247.19 dev calia503d69ba27 scope link 
10.12.247.21 dev cali67ae3c45c76 scope link 
10.12.247.22 dev calibd069ba32fe scope link 
10.12.247.25 dev cali06279f35883 scope link 
10.12.247.26 dev cali6d5a63f1c76 scope link 
192.169.91.240 dev veth3aeddf3a03f scope link 
192.169.91.241 dev veth946f1e3e395 scope link 
192.169.91.242 dev veth46ac33b57ac scope link 
192.169.91.243 dev veth9415b594ba5 scope link 
192.169.91.245 dev veth0b9bfeae660 scope link 
192.169.91.246 dev veth84347dd652f scope link 
192.169.91.247 dev veth1abb6a9b418 scope link 
192.169.91.248 dev veth00c3653788b scope link 
192.169.91.249 dev veth294dbed9792 scope link 
192.168.80.0/22 dev eno1 proto kernel scope link src 192.168.80.82 metric 100
```
- calicoctl get ippools -o wide
```
[root@controller-node-1 ~]# calicoctl get ippools -o wide
NAME           CIDR           NAT    IPIPMODE      VXLANMODE   DISABLED   DISABLEBGPEXPORT   SELECTOR   
default-pool   10.12.0.0/16   true   CrossSubnet   Never       false      false              all()
```
- kubectl get sp vlan168-public -o yaml
```
[root@controller-node-1 ~]# kubectl get sp vlan168-public -o yaml
apiVersion: spiderpool.spidernet.io/v2beta1
kind: SpiderIPPool
metadata:
  creationTimestamp: "2023-05-04T06:07:35Z"
  finalizers:
  - spiderpool.spidernet.io
  generation: 1
  labels:
    ipam.spidernet.io/ippool-cidr: 192-168-88-0-22
    ipam.spidernet.io/owner-spider-subnet: vlan168
  name: vlan168-public
  ownerReferences:
  - apiVersion: spiderpool.spidernet.io/v2beta1
    blockOwnerDeletion: true
    controller: true
    kind: SpiderSubnet
    name: vlan168
    uid: 39676fa4-995e-4deb-a1bc-2c20790025df
  resourceVersion: "6122048"
  uid: 56a1d81e-847b-4dfc-8813-e70bb725f0c1
spec:
  default: false
  disable: false
  gateway: 192.169.88.1
  ipVersion: 4
  ips:
  - 192.169.91.240-192.169.91.244
  subnet: 192.169.88.0/22
  vlan: 168
status:
  allocatedIPCount: 2
  allocatedIPs: '{"192.169.91.240":{"interface":"eth0","pod":"default/wf-test-5c84c65968-mnp8n","podUid":"6887f447-112c-463b-8941-dfdc585bd8b7"},"192.169.91.241":{"interface":"eth0","pod":"default/wf-test-5c84c65968-c8f97","podUid":"e4ca713b-0aa6-470b-a43b-b93753760f6d"}}'
  totalIPCount: 5
```
- kubectl exec -it <macvlan_pod> -- ip a
```
[root@controller-node-1 ~]# kubectl exec -it wf-test-5c84c65968-c8f97 -- ip a
1: lo: <LOOPBACK,UP,LOWER_UP> mtu 65536 qdisc noqueue state UNKNOWN qlen 1000
    link/loopback 00:00:00:00:00:00 brd 00:00:00:00:00:00
    inet 127.0.0.1/8 scope host lo
       valid_lft forever preferred_lft forever
    inet6 ::1/128 scope host 
       valid_lft forever preferred_lft forever
2: tunl0@NONE: <NOARP> mtu 1480 qdisc noop state DOWN qlen 1000
    link/ipip 0.0.0.0 brd 0.0.0.0
3: eth0@if17: <BROADCAST,MULTICAST,UP,LOWER_UP,M-DOWN> mtu 1500 qdisc noqueue state UP 
    link/ether 8e:a2:8b:0d:e0:d3 brd ff:ff:ff:ff:ff:ff
    inet 192.169.91.241/22 brd 192.169.91.255 scope global eth0
       valid_lft forever preferred_lft forever
    inet6 fe80::8ca2:8bff:fe0d:e0d3/64 scope link 
       valid_lft forever preferred_lft forever
4: veth0@if74: <BROADCAST,MULTICAST,UP,LOWER_UP,M-DOWN> mtu 1500 qdisc noqueue state UP 
    link/ether ba:e9:4d:5a:47:26 brd ff:ff:ff:ff:ff:ff
    inet6 fe80::b8e9:4dff:fe5a:4726/64 scope link 
       valid_lft forever preferred_lft forever
```
- kubectl exec -it <macvlan_pod> -- ip r
```
[root@controller-node-1 ~]# kubectl exec -it wf-test-5c84c65968-c8f97 -- ip r
default via 192.169.88.1 dev eth0 
10.12.0.0/16 via 192.168.80.82 dev veth0 
10.13.0.0/16 via 192.168.80.82 dev veth0 
192.169.88.0/22 dev eth0 scope link  src 192.169.91.241 
192.168.80.82 dev veth0 scope link
```

**Comment by cyclinder** [comment]
This should indeed be a bug in kube-proxy, refer to https://github.com/kubernetes/kubernetes/issues/94861#issuecomment-1541635413

**Comment by aojea** [comment]
> The principle is that there is a routing asymmetry problem with the packets going out and coming back when macvlan is used in standalone mode. The iptables rule of kube-proxy will discard the packets with routing asymmetry.

can we describe the asymmetry that happens here and the packet flow?

**Comment by cyclinder** [comment]
@aojea sure :）

**Comment by cyclinder** [comment]
@aojea  If you want to reproduce it quickly, you can refer to this document：https://github.com/spidernet-io/cni-plugins/blob/main/docs/usage/basic.md (using underlay mode)

In my cluster, macvlan and calico pods exist at the same time, And we want them to have access to each other. 

```shell
root@controller:~/cyclinder# kubectl get po -o wide
NAME                                                        READY   STATUS      RESTARTS       AGE     IP               NODE         NOMINATED NODE   READINESS GATES
dao-2048-76c4d86dbd-tm2pc                                   1/1     Running     0              105m    10.233.105.186   worker1      <none>           <none>
dao-2048-76c4d86dbd-w2xhx                                   1/1     Running     0              105m    10.233.119.201   controller   <none>           <none>
macvlan-only-vlan0-d5fbdd8dd-hdnfn                          1/1     Running     0              104m    10.6.212.202     worker1      <none>           <none>
macvlan-only-vlan0-d5fbdd8dd-n76cl                          1/1     Running     0              104m    10.6.212.207     controller   <none>           <none>
```

Except for the macvlan pod which cannot curl the IP of the calico pod directly, other things like pinging or cure the service of the calico pod are works.

**Comment by aojea** [comment]
> ept for the macvlan pod which cannot curl the IP of the calico pod directly,

can we get the tcpdump of that traffic and describe the interfaces involved?

**Comment by cyclinder** [comment]
`10.233.105.186` is calico pod's IP, it's from clusterCIDR 

```shell
root@controller:~# kubectl get cm -n kube-system kube-proxy -o yaml | grep clusterCIDR
    clusterCIDR: 10.233.64.0/18,fd85:ee78:d8a6:8607::1:0000/112
```

`10.6.212.207 ` is macvlan pod's IP, These IPs belong to the same network segment as the node.
```shell
root@controller:~# ip a show ens160
2: ens160: <BROADCAST,MULTICAST,UP,LOWER_UP> mtu 1500 qdisc mq state UP group default qlen 1000
    link/ether 00:50:56:b4:ce:ad brd ff:ff:ff:ff:ff:ff
    altname enp3s0
    inet 10.6.212.101/16 brd 10.6.255.255 scope global ens160
       valid_lft forever preferred_lft forever
    inet6 fd00:10:6::101/64 scope global
       valid_lft forever preferred_lft forever
    inet6 fe80::250:56ff:feb4:cead/64 scope link
       valid_lft forever preferred_lft forever
```

**Comment by cyclinder** [comment]
request packet flow:

10.6.212.207 -> 10.233.105.186

```shell
macvlan pod(10.6.212.207) -> controller-node -> vxlan.calico -> worker-node -> calico-pod(`10.233.105.186 `)
```
response packet flow:

10.6.212.207 -> 10.233.105.186
```shell
calico-pod(`10.233.105.186 `)  -> worker-node -> (dstIP is 10.6.212.207 ) -> ens160 ->  controller-node(ens160) -> drop packet in INVALID state
```

on worker-node:

```

root@worker1:~# tcpdump -nne -i calid6c772559cb tcp and host 10.233.105.186
tcpdump: verbose output suppressed, use -v[v]... for full protocol decode
listening on calid6c772559cb, link-type EN10MB (Ethernet), snapshot length 262144 bytes
18:11:29.704916 ee:ee:ee:ee:ee:ee > 2a:83:dd:c2:f5:6e, ethertype IPv4 (0x0800), length 74: 10.6.212.207.53880 > 10.233.105.186.80: Flags [S], seq 272185043, win 64240, options [mss 1460,sackOK,TS val 3557526442 ecr 0,nop,wscale 7], length 0
18:11:29.704945 2a:83:dd:c2:f5:6e > ee:ee:ee:ee:ee:ee, ethertype IPv4 (0x0800), length 74: 10.233.105.186.80 > 10.6.212.207.53880: Flags [S.], seq 1385946343, ack 272185044, win 64766, options [mss 1390,sackOK,TS val 1121635817 ecr 3557526442,nop,wscale 7], length 0
18:11:30.708330 2a:83:dd:c2:f5:6e > ee:ee:ee:ee:ee:ee, ethertype IPv4 (0x0800), length 74: 10.233.105.186.80 > 10.6.212.207.53880: Flags [S.], seq 1385946343, ack 272185044, win 64766, options [mss 1390,sackOK,TS val 1121636821 ecr 3557526442,nop,wscale 7], length 0
18:11:32.724329 2a:83:dd:c2:f5:6e > ee:ee:ee:ee:ee:ee, ethertype IPv4 (0x0800), length 74: 10.233.105.186.80 > 10.6.212.207.53880: Flags [S.], seq 1385946343, ack 272185044, win 64766, options [mss 1390,sackOK,TS val 1121638837 ecr 3557526442,nop,wscale 7], length 0


root@worker1:~# ip a show ens160
2: ens160: <BROADCAST,MULTICAST,UP,LOWER_UP> mtu 1500 qdisc mq state UP group default qlen 1000
    link/ether 00:50:56:b4:d3:2a brd ff:ff:ff:ff:ff:ff
    altname enp3s0
    inet 10.6.212.102/16 brd 10.6.255.255 scope global ens160
       valid_lft forever preferred_lft forever
    inet6 fd00:10:6::102/64 scope global
       valid_lft forever preferred_lft forever
    inet6 fe80::250:56ff:feb4:d32a/64 scope link
       valid_lft forever preferred_lft forever
root@worker1:~# ip r get 10.6.212.207
10.6.212.207 dev ens160 src 10.6.212.102 uid 0
```

on controller-node:

```
root@controller:~# ip a show ens160
2: ens160: <BROADCAST,MULTICAST,UP,LOWER_UP> mtu 1500 qdisc mq state UP group default qlen 1000
    link/ether 00:50:56:b4:ce:ad brd ff:ff:ff:ff:ff:ff
    altname enp3s0
    inet 10.6.212.101/16 brd 10.6.255.255 scope global ens160
       valid_lft forever preferred_lft forever
    inet6 fd00:10:6::101/64 scope global
       valid_lft forever preferred_lft forever
    inet6 fe80::250:56ff:feb4:cead/64 scope link
       valid_lft forever preferred_lft forever

root@controller:~# tcpdump -nne -i ens160 tcp and host 10.233.105.186
tcpdump: verbose output suppressed, use -v[v]... for full protocol decode
listening on ens160, link-type EN10MB (Ethernet), snapshot length 262144 bytes
18:14:51.485206 00:50:56:b4:d3:2a > 1a:3b:0a:06:d4:cf, ethertype IPv4 (0x0800), length 74: 10.233.105.186.80 > 10.6.212.207.39562: Flags [S.], seq 888615353, ack 1308424650, win 64766, options [mss 1390,sackOK,TS val 1121758141 ecr 3557648759,nop,wscale 7], length 0
18:14:52.505496 00:50:56:b4:d3:2a > 1a:3b:0a:06:d4:cf, ethertype IPv4 (0x0800), length 74: 10.233.105.186.80 > 10.6.212.207.39562: Flags [S.], seq 888615353, ack 1308424650, win 64766, options [mss 1390,sackOK,TS val 1121759160 ecr 3557648759,nop,wscale 7], length 0
18:14:54.519974 00:50:56:b4:d3:2a > 1a:3b:0a:06:d4:cf, ethertype IPv4 (0x0800), length 74: 10.233.105.186.80 > 10.6.212.207.39562: Flags [S.], seq 888615353, ack 1308424650, win 64766, options [mss 1390,sackOK,TS val 1121761177 ecr 3557648759,nop,wscale 7], length 0
```

**Comment by aojea** [comment]
so the problem is that the request is sent through the vxlan tunnel but the reply is sent via the node network ...

🤔  despite you solve the ping problem, does Services work from the macvlan pod? can you curl a Service without the INVALID rule?

**Comment by cyclinder** [comment]
curl a servicer is both works with or without the INVALID rule, the INVALID rule only affects curl calico pod‘s IP directly

```shell
root@controller:~# iptables-save -t  filter | grep KUBE-FORWARD
:KUBE-FORWARD - [0:0]
-A FORWARD -m comment --comment "kubernetes forwarding rules" -j KUBE-FORWARD
-A KUBE-FORWARD -m conntrack --ctstate INVALID -j DROP
-A KUBE-FORWARD -m comment --comment "kubernetes forwarding rules" -m mark --mark 0x4000/0x4000 -j ACCEPT
-A KUBE-FORWARD -m comment --comment "kubernetes forwarding conntrack rule" -m conntrack --ctstate RELATED,ESTABLISHED -j ACCEPT
# Warning: iptables-legacy tables present, use iptables-legacy-save to see them
root@controller:~# kubectl get svc  dao-2048
NAME       TYPE        CLUSTER-IP     EXTERNAL-IP   PORT(S)   AGE
dao-2048   ClusterIP   10.233.15.92   <none>        80/TCP    40d
root@controller:~# kubectl exec -it macvlan-only-vlan0-d5fbdd8dd-n76cl -- curl 10.233.15.92 -I
HTTP/1.1 200 OK
Server: nginx/1.23.1
Date: Wed, 10 May 2023 10:49:23 GMT
Content-Type: text/html
Content-Length: 4055
Last-Modified: Fri, 23 Sep 2022 02:53:30 GMT
Connection: keep-alive
ETag: "632d1faa-fd7"
Accept-Ranges: bytes
```

**Comment by aojea** [comment]
this is a bit problematic, since the INVALID rule solves a legit but and this network config is a bit "awkward"

**Comment by cyclinder** [comment]
network config..? What exactly is network config?

**Comment by cyclinder** [comment]
The network topology makes sense, as we typically deploy two types of pods in our cluster: underlay-type and overlay-type. overlay-type pods usually have their Pod IPs assigned from a global virtual subnet, and when communicating with the outside, the source IP is SNAT to the node's IP. but underlay-type pods have real Underlay-type IPs, which they can use directly to communicate with the outside world without SNAT.

I think the behavior of the kube-proxy is a bit of an "overkill", it prevents Pods on external cidr from communicating with Pods on the cluster cidr

**Comment by aojea** [comment]
> source IP is SNAT to the node's IP.

this is a problem in this specific flow, isn't it?

**Comment by aojea** [comment]
yeah, fair point

**Comment by cyclinder** [comment]
fixed by https://github.com/kubernetes/kubernetes/pull/120412

/close
